{
  "id": "enterprise/multi-user-setup-003",
  "category": "enterprise",
  "viewport": {
    "width": 1280,
    "height": 800,
    "deviceScaleFactor": 1
  },
  "seed": 12345,
  "ground_truth": {
    "h_cta_above_fold": false,
    "h_steps_count": 5,
    "h_copy_clarity": "fair",
    "h_trust_markers": 5,
    "h_perceived_signup_speed_sec": 90,
    "a11y_focus_trap": true
  },
  "expected": {
    "score_band": [
      60,
      75
    ],
    "top_issues_contains": [
      "steps_count",
      "trust_markers"
    ]
  }
}
