{
  "id": "mobile/mobile-long-form-006",
  "category": "mobile",
  "viewport": {
    "width": 375,
    "height": 812,
    "deviceScaleFactor": 2
  },
  "seed": 66666,
  "ground_truth": {
    "h_cta_above_fold": true,
    "h_steps_count": 8,
    "h_copy_clarity": "good",
    "h_trust_markers": 4,
    "h_perceived_signup_speed_sec": 150,
    "a11y_focus_trap": true
  },
  "expected": {
    "score_band": [
      50,
      65
    ],
    "top_issues_contains": [
      "steps_count",
      "perceived_signup_speed"
    ]
  }
}