{
  "id": "mobile/mobile-below-fold-009",
  "category": "mobile",
  "viewport": {
    "width": 375,
    "height": 812,
    "deviceScaleFactor": 2
  },
  "seed": 99999,
  "ground_truth": {
    "h_cta_above_fold": false,
    "h_steps_count": 3,
    "h_copy_clarity": "good",
    "h_trust_markers": 2,
    "h_perceived_signup_speed_sec": 45,
    "a11y_focus_trap": true
  },
  "expected": {
    "score_band": [
      50,
      65
    ],
    "top_issues_contains": [
      "cta_above_fold"
    ]
  }
}