{
  "id": "mobile/app-onboarding-004",
  "category": "mobile",
  "viewport": {
    "width": 1280,
    "height": 800,
    "deviceScaleFactor": 1
  },
  "seed": 12345,
  "ground_truth": {
    "h_cta_above_fold": true,
    "h_steps_count": 2,
    "h_copy_clarity": "good",
    "h_trust_markers": 2,
    "h_perceived_signup_speed_sec": 25,
    "a11y_focus_trap": false
  },
  "expected": {
    "score_band": [
      70,
      85
    ],
    "top_issues_contains": [
      "steps_count",
      "trust_markers"
    ]
  }
}
