{
  "id": "saas/below-fold-009",
  "category": "saas",
  "viewport": {
    "width": 1280,
    "height": 800,
    "deviceScaleFactor": 1
  },
  "seed": 65440,
  "ground_truth": {
    "h_cta_above_fold": false,
    "h_steps_count": 3,
    "h_copy_clarity": "good",
    "h_trust_markers": 4,
    "h_perceived_signup_speed_sec": 70,
    "a11y_focus_trap": false
  },
  "expected": {
    "score_band": [
      65,
      80
    ],
    "top_issues_contains": [
      "cta_above_fold"
    ]
  }
}