{
  "id": "mobile/mobile-poor-copy-008",
  "category": "mobile",
  "viewport": {
    "width": 375,
    "height": 812,
    "deviceScaleFactor": 2
  },
  "seed": 88888,
  "ground_truth": {
    "h_cta_above_fold": true,
    "h_steps_count": 4,
    "h_copy_clarity": "poor",
    "h_trust_markers": 2,
    "h_perceived_signup_speed_sec": 60,
    "a11y_focus_trap": true
  },
  "expected": {
    "score_band": [
      45,
      60
    ],
    "top_issues_contains": [
      "copy_clarity"
    ]
  }
}