{
  "id": "saas/payment-integration-007",
  "category": "saas",
  "viewport": {
    "width": 1280,
    "height": 800,
    "deviceScaleFactor": 1
  },
  "seed": 65438,
  "ground_truth": {
    "h_cta_above_fold": true,
    "h_steps_count": 4,
    "h_copy_clarity": "good",
    "h_trust_markers": 9,
    "h_perceived_signup_speed_sec": 80,
    "a11y_focus_trap": false
  },
  "expected": {
    "score_band": [
      70,
      85
    ],
    "top_issues_contains": [
      "steps_count"
    ]
  }
}