{
  "id": "ecommerce/poor-copy-009",
  "category": "ecommerce",
  "viewport": {
    "width": 1280,
    "height": 800,
    "deviceScaleFactor": 1
  },
  "seed": 54321,
  "ground_truth": {
    "h_cta_above_fold": true,
    "h_steps_count": 4,
    "h_copy_clarity": "poor",
    "h_trust_markers": 2,
    "h_perceived_signup_speed_sec": 60,
    "a11y_focus_trap": true
  },
  "expected": {
    "score_band": [
      45,
      60
    ],
    "top_issues_contains": [
      "copy_clarity"
    ]
  }
}