{
  "id": "ecommerce/shipping-address-004",
  "category": "ecommerce",
  "viewport": {
    "width": 1280,
    "height": 800,
    "deviceScaleFactor": 1
  },
  "seed": 76546,
  "ground_truth": {
    "h_cta_above_fold": true,
    "h_steps_count": 5,
    "h_copy_clarity": "good",
    "h_trust_markers": 3,
    "h_perceived_signup_speed_sec": 100,
    "a11y_focus_trap": true
  },
  "expected": {
    "score_band": [
      60,
      75
    ],
    "top_issues_contains": [
      "steps_count",
      "perceived_signup_speed"
    ]
  }
}